colorIndex,message,name,code
140,"Quelqu'un a dû laisser sa veste ici... Il est écrit dans le dos 'Détenu n°7468'",Veste,7468
141,"Il y a un bout de tuyau par terre... Il n'y a pas de fuite$ pourtant ! Sûrement à cause de l'absence de douche. Le tuyau est labelisé '6f6d'",Tuyau,6f6d
142,"Quelqu'un a laissé son plateau. Il faut penser à nettoyer ! Il reste sa carte de détenu... Numéro 6173 !",IDCarte,6173
143,"Wow ! Il y a un petit pistolet... Modèle 6d6$ un très vieux qui ne marche plus.",Pistolet,6d6
144,"Il est noté au tableau une suite de lettres qui ne font aucun sens... Sûrement un code pour les femmes de ménage ! '16e6'",CodeDeCellule,16e6
145,"Quelle salle étrange... Elle vous rappelle un autre jeu. Sur la table$ il y a une carte nommée 'f6ea'. Signé Igor.",CartePersona,f6ea
146,"Un homme vous interrompt alors que vous marchez. Il vous montre les murs de sa cellule$ cela fait 1452 secondes qu'il est là! Il les compte??",HommeBizarre,1452
147,"Vous trouvez un livre... 'Python pour les nuls'. Edition qui date de... 1991 ! Un peu vieux...",Python,1991